emotion,num,valence,source,person,content,length_in_words,duration_in_secs,cause,keeper
Nostalgic,4,pos,generated,3rd,crew team,54,NaN,"NAMEVAR competed on the varsity crew team in college, and cherished the hours she had spent rowing on the Charles River. Every year, she returned to Cambridge for the Head of the Charles crew regatta. Watching the younger girls compete reminded her of the times she had spent on the river with her team.",1
Nostalgic,5,pos,generated,3rd,dinner reminiscing,40,NaN,NAMEVAR went out to dinner with a couple of close college friends she had not seen in years. They ordered rounds of drinks and sat around reminiscing about their college antics and adventures until the bar closed at 3 AM.,1
Proud,1,pos,generated,3rd,mit party,47,NaN,"NAMEVAR recently enrolled at MIT with the goal of majoring in biomedical engineering. Her family believed strongly in the value of education, and she was the first of her family to attend college. Friends and family from her home town and threw a party celebrating the honor.",1
Proud,2,pos,generated,3rd,record label,46,NaN,"NAMEVAR always wanted to be part of the music industry, but didn!!!t have strong musical talent. After earning all As in her degree in music management, NAMEVAR started an independent record label. Within a year they were making substantial profits and had signed several successful artists.",1
Proud,3,pos,generated,3rd,opthamology,50,NaN,"In September, NAMEVAR joined a small ophthalmology practice, her first job out of medical school. She worked hard to develop relationships with her patients, and to recruit new clients to the practice. By May, she had doubled the company!!!s clientele and received an award for early career success in ophthalmology.",1
Proud,4,pos,generated,3rd,Carnegie Hall,44,NaN,"NAMEVAR had played the piano intensively since she was five years old. She attended The Juilliard School where she continued to practice feverishly. Towards the end of her senior year, NAMEVAR was asked to play Rhapsody in Blue, a personal favorite, at Carnegie Hall.",1
Proud,5,pos,generated,3rd,restaurant inspection,45,NaN,"NAMEVAR took over her father!!!s restaurant. On the verge of bankruptcy, the restaurant had fallen into disarray and was about to be shut down by the FDA. NAMEVAR worked hard to bring it back to life, and they received an A on the next inspection.",1
Surprise,1,neutral,generated,3rd,friend home,58,NaN,"One day, NAMEVAR thought she was the only one around the house. She put on some music to listen to while she baked a cake for her friends. She wandered around the kitchen,  singing along to her favorite song. Suddenly, NAMEVAR heard a second voice joining in and turned around to see that her roommate was in fact home.",1
Surprise,2,neutral,generated,3rd,surprise visit,57,NaN,"NAMEVAR's sister lived on the opposite side of the country. One weekend, NAMEVAR returned to her dorm room after a long week of work. A few minutes later she heard a knock on the door. She opened it to see her sister standing on the doorstep. She had flown across the country to visit for the weekend.",1
Surprise,3,neutral,generated,3rd,surprise gift,55,NaN,"On NAMEVAR's 16th birthday, her boyfriend picked her up to take her to the movies. Instead of going to the movie theater, he pulled into a concert venue where her favorite band was playing. She had thought tickets were sold out, but it turns out he had bought her a backstage pass for her birthday.",1
Surprise,4,neutral,generated,3rd,surprise party,52,NaN,"After defending her Ph.D., NAMEVAR headed home to spend the evening with her husband. As she walked down the hallway, she thought she heard voices in the apartment. She opened the door to find that her friends, family, advisors and graduate student colleagues had all gathered at her home to celebrate.",1
Surprise,5,neutral,generated,3rd,snow,49,NaN,"NAMEVAR lived in Las Angelas where it was usually warm all year long. One December, NAMEVAR was walking home from work in a t-shirt and shorts. She felt something cold and wet on her cheek. She looked up to see flurries of snowflakes falling to the ground around her.",1